{
  "opera_riferimento": {
    "titolo": "Le città di pianura",
    "autore": "Francesco Sossai"
  },
  "nucleo_tematico_centrale": {
    "formulazione": "Il film mette in forma la questione di che cosa accada al desiderio e all'orientamento di vita quando il mondo che li ha generati — il Veneto della pianura, dei capannoni, dei bar, dell'amicizia maschile periferica — è già diventato un paesaggio postumo, abitato da figure che ne custodiscono il codice senza più poterlo trasmettere. Il nucleo è la trasmissione mancata: un'iniziazione che si compie come separazione, non come eredità.",
    "motivazione": "Il dossier individua tre elementi che, messi in relazione, convergono su questo nucleo: (a) l'asimmetria strutturale tra i due cinquantenni squattrinati e il giovane studente di architettura, fissata dal finale in cui Giulio si stacca anziché integrarsi; (b) la pianura veneta descritta come territorio compromesso (cementificazione, case 'Vendesi', capannoni, occhialeria in declino, scarti produttivi), cioè come mondo che non offre più condizioni di possibilità per le vite che vi sono state generate; (c) l'attesa di Genio dall'Argentina e il denaro sepolto: un ritorno che è di fatto un riavvolgimento del passato, non una rifondazione. La 'iniziazione conclusa per separazione' segnalata esplicitamente dalle fonti è il punto in cui questi tre elementi si saldano."
  },
  "ipotesi_critica_provvisoria": {
    "tesi": "Le città di pianura è un film sul desiderio come effetto collaterale di un mondo finito: i due cinquantenni non sono maestri di vita ma testimoni residuali di una forma di esistenza (amicizia, rituale dell'ultimo bicchiere, rapporto artigianale con il territorio) che il paesaggio circostante ha già reso impraticabile; Giulio non eredita questo codice ma se ne lascia attraversare quanto basta per riorientare il proprio desiderio altrove. La trasformazione del giovane non è il frutto di una trasmissione riuscita ma di un passaggio attraverso un'esperienza già marcata dalla perdita: incontra non il modello, ma la sua sopravvivenza commovente. L'iniziazione, in questo senso, coincide con la presa d'atto che il mondo dei mentori non è più trasmissibile — ed è proprio questa presa d'atto, e non un contenuto positivo, ciò che lo trasforma.",
    "basi_nel_dossier": [
      "Esito narrativo descritto dalle fonti come 'iniziazione conclusa più per separazione che per integrazione'",
      "Caratterizzazione dei due cinquantenni come squattrinati, fedeli a un codice 'demodé', ostinati nel proprio mondo",
      "Sequenza delle case 'Vendesi' e ricorrenza visiva di un Veneto compromesso da cementificazione e periferie produttive",
      "Antefatto di Genio (fuga in Argentina, scarti di occhialeria, crisi 2008): il quarto amico assente come orizzonte mai del tutto raggiunto",
      "Scelta della pellicola analogica (16mm e 35mm) come marcatore formale di un mondo già al passato",
      "Tappa al Memoriale Brion di Carlo Scarpa come snodo per il giovane architetto: confronto con un'architettura che pensa la morte, la soglia, la separazione",
      "Tono ibrido segnalato dalle recensioni (leggerezza comica + fondo malinconico), coerente con un'iniziazione che si compie per perdita",
      "Riferimento esplicito del regista a Im Lauf der Zeit di Wenders (cinema della deriva senza meta integrativa) accanto a Il sorpasso (iniziazione che termina in catastrofe)"
    ],
    "carattere_provvisorio": "L'ipotesi potrebbe essere smentita o ridimensionata da una lettura attenta del film se: (a) il finale risultasse più riconciliativo di quanto le fonti suggeriscano, con un effettivo passaggio di consegne tra mentori e allievo; (b) i due cinquantenni risultassero figure più ironicamente distanziate che elegiacamente presentate, con un tono che li satireggia anziché commemorarli; (c) il ritorno di Genio o il denaro ritrovato costituissero una vera risoluzione narrativa, indebolendo la lettura del quarto amico come orizzonte fallito; (d) la dimensione architettonica (Brion) risultasse decorativa o citazionistica anziché strutturale; (e) il sentimento non dichiarato di Giulio per un coetaneo si rivelasse meno marginale di quanto il dossier indichi, spostando il baricentro del film verso una questione di soggettivazione affettiva del giovane più che verso la trasmissione mancata."
  },
  "tensioni_principali": [
    {
      "descrizione": "Tra una forma di vita pienamente abitata e un mondo che non la sostiene più: i due cinquantenni vivono dall'interno un codice (bevuta, amicizia, orientamento a memoria) che il territorio circostante ha già svuotato delle sue condizioni materiali. La loro fedeltà non è scelta culturale, è ostinazione esistenziale; il paesaggio attorno è già un altro mondo.",
      "polo_a": "Codice di vita vissuto dall'interno, con coerenza propria",
      "polo_b": "Paesaggio che ha già dismesso le condizioni di possibilità di quel codice",
      "dove_si_manifesta": "Contrasto fra le routine dei due cinquantenni (bar, ultimo bicchiere, mappe a mano) e la sequenza delle case 'Vendesi', i capannoni, le infrastrutture nuove."
    },
    {
      "descrizione": "Tra iniziazione e separazione: la struttura del road movie con mentore e allievo implica una trasmissione, ma il film la realizza come distacco. Il giovane non riceve un'eredità positiva: riceve l'esperienza che il modello esiste ancora ma è già fuori tempo. La trasmissione che riesce è la trasmissione di una soglia.",
      "polo_a": "Forma classica della trasmissione (mentore → allievo)",
      "polo_b": "Esito reale di passaggio per separazione",
      "dove_si_manifesta": "Arco completo del rapporto Giulio – Carlobianchi/Doriano, esplicitato nella scena finale del distacco."
    },
    {
      "descrizione": "Tra presenza e attesa, tra i tre che viaggiano e il quarto che dovrebbe tornare: Genio è il punto di fuga del film, ma è una promessa che organizza il presente senza riempirlo. La pienezza non è qui, è altrove (in Argentina, nel passato, nel denaro sepolto), e ciò che si vive nel viaggio è la sua sostituzione provvisoria.",
      "polo_a": "Materialità dei tre che attraversano la pianura",
      "polo_b": "Orizzonte assente di Genio e del passato sepolto",
      "dove_si_manifesta": "Linea narrativa di sfondo dell'attesa del ritorno dall'Argentina e del denaro da ritrovare."
    },
    {
      "descrizione": "Tra ambiguità etica dei mentori e funzione iniziatica che essi svolgono: i due cinquantenni non sono autorità legittimate (sono squattrinati, dediti all'alcol, legati a un passato illecito), eppure il film affida loro la mediazione fra Giulio e un'esperienza del mondo. Il codice ha autorità senza averne i titoli; la trasmissione passa per figure che la cultura ufficiale escluderebbe.",
      "polo_a": "Disautorizzazione sociale dei mentori",
      "polo_b": "Effettiva funzione mediatrice che essi esercitano sul giovane",
      "dove_si_manifesta": "Tutto il rapporto Giulio – Carlobianchi/Doriano; antefatto della vicenda di Genio come passato condiviso dei mentori."
    },
    {
      "descrizione": "Tra il Veneto come paesaggio affettivo e il Veneto come luogo di una perdita pubblica: il film guarda il territorio con tenerezza ma lo registra come compromesso. Non è solo malinconia individuale: è il lutto di un certo modo collettivo di abitare il Nord-Est che è già accaduto, fuori campo, prima dell'inizio del film.",
      "polo_a": "Sguardo affettivo, riconoscente, sui luoghi della pianura",
      "polo_b": "Constatazione documentaria del loro deterioramento e della loro mutazione",
      "dove_si_manifesta": "Sequenze panoramiche, sequenza delle case 'Vendesi', contrasto fra cemento e dolomite, scelta della pellicola analogica."
    },
    {
      "descrizione": "Tra timidezza e desiderio nel giovane Giulio: il film parte da una sua condizione di apparente deriva esistenziale (e da un possibile affetto non dichiarato) e lo lascia 'ridisegnato' nelle proprie prospettive. Il viaggio non aggiunge contenuti al suo desiderio: gli fornisce una distanza dalla quale esso può finalmente formularsi.",
      "polo_a": "Stato iniziale di sospensione, timidezza, non-detto",
      "polo_b": "Soggettivazione del desiderio raggiunta attraverso il distacco dai mentori",
      "dove_si_manifesta": "Antefatto della laurea, sviluppo del rapporto coi mentori, separazione finale come gesto attivo del giovane."
    },
    {
      "descrizione": "Tra tono comico e fondo malinconico: il film tiene insieme la leggerezza delle situazioni con la consapevolezza che ciò che viene mostrato è già perduto. La risata non smorza la perdita, la attraversa; la malinconia non spegne la comicità, la rende possibile come modo di reggere la perdita.",
      "polo_a": "Registro della commedia agrodolce, situazioni surreali, rituale dell'alcol",
      "polo_b": "Sostrato di marginalità economica, fallimento, vite ai margini",
      "dove_si_manifesta": "Distribuita su tutto il film; segnalata esplicitamente dalle recensioni come tono ibrido."
    }
  ],
  "domande_critiche_aperte": [
    {
      "domanda": "Il Memoriale Brion funziona nel film come citazione colta o come dispositivo strutturale? In altre parole: l'architettura della soglia, del passaggio, della morte pensata di Carlo Scarpa è solo location simbolicamente carica o è il modello formale segreto del film stesso (un film che pensa, come Brion, la separazione come forma)?",
      "motivazione": "Se la prima ipotesi è vera, il Brion è uno snodo tematico tra altri; se la seconda è vera, il film prende dalla tomba di Scarpa la propria forma — l'iniziazione come architettura della separazione, non dell'integrazione — e diventa una proposta formale, non solo tematica."
    },
    {